{
  "schema_version": "1.0.0",
  "contact_id": "0192a1b2-c3d4-7e5f-8a9b-0c1d2e3f4a60",
  "contact_class": "third_party",
  "display_label_ref": {
    "content_key_id": "0192a1b2-c3d4-7e5f-8a9b-0c1d2e3f4a61",
    "blob_id": "0192a1b2-c3d4-7e5f-8a9b-0c1d2e3f4a62",
    "alg": "xchacha20poly1305-ietf",
    "aad": "0192a1b2-c3d4-7e5f-8a9b-0c1d2e3f4a60|display_label_ref",
    "subject": "third_party",
    "char_count": 2,
    "placeholder": "[联系人]"
  },
  "identifiers": [
    {
      "kind": "handle",
      "value_hash": "0123456789abcdef0123456789abcdef0123456789abcdef0123456789abcdef"
    }
  ],
  "forget_state": "active"
}
